{
  "type": "screencast_script_spec",
  "project_root": ".",
  "path": "Docs/Documentation/Screencast_Quickstart.md",
  "overwrite": true,
  "script_spec": {
    "title": "Quickstart Screencast",
    "audience": "End users",
    "goal": "Show installation + first run",
    "duration": "5-7 min",
    "chapters": [
      {"timestamp": "00:00", "title": "Intro", "on_screen": "Open repo", "narration": "What we will do"},
      {"timestamp": "01:00", "title": "Install", "on_screen": "Run install command", "narration": "Explain prerequisites"}
    ]
  }
}
